{
  "$schema": "https://opencode.ai/desktop-theme.json",
  "name": "Everforest",
  "id": "everforest",
  "light": {
    "palette": {
      "neutral": "#fdf6e3",
      "ink": "#5c6a72",
      "primary": "#8da101",
      "accent": "#df69ba",
      "success": "#8da101",
      "warning": "#f57d26",
      "error": "#f85552",
      "info": "#35a77c",
      "diffAdd": "#4db380",
      "diffDelete": "#f52a65"
    },
    "surfaces": {
      "shell": "#f1ead8",
      "canvas": "#fdf6e3",
      "raised": "#ffffff",
      "inset": "#e7e0ce"
    },
    "overrides": {
      "syntax-comment": "#6a7365",
      "syntax-keyword": "#b54593",
      "syntax-string": "#68761b",
      "syntax-primitive": "#68761b",
      "syntax-variable": "#c7413f",
      "syntax-property": "#13805b",
      "syntax-type": "#926802",
      "syntax-constant": "#b25710",
      "syntax-operator": "#13805b",
      "syntax-punctuation": "#5c6a72",
      "syntax-object": "#c7413f",
      "markdown-heading": "#b54593",
      "markdown-link": "#68761b",
      "markdown-link-text": "#13805b",
      "markdown-code": "#68761b",
      "markdown-block-quote": "#926802",
      "markdown-emph": "#926802",
      "markdown-strong": "#b25710",
      "markdown-horizontal-rule": "#a6b0a0",
      "markdown-list-item": "#8da101",
      "markdown-list-enumeration": "#35a77c",
      "markdown-image": "#8da101",
      "markdown-image-text": "#35a77c",
      "text-interactive-base": "#687617"
    }
  },
  "dark": {
    "palette": {
      "neutral": "#2d353b",
      "ink": "#d3c6aa",
      "primary": "#a7c080",
      "accent": "#d699b6",
      "success": "#a7c080",
      "warning": "#e69875",
      "error": "#e67e80",
      "info": "#83c092",
      "diffAdd": "#b8db87",
      "diffDelete": "#e26a75"
    },
    "surfaces": {
      "shell": "#262e34",
      "canvas": "#2d353b",
      "raised": "#3b434a",
      "inset": "#20272d"
    },
    "overrides": {
      "syntax-comment": "#7a8478",
      "syntax-keyword": "#d699b6",
      "syntax-string": "#a7c080",
      "syntax-primitive": "#a7c080",
      "syntax-variable": "#e67e80",
      "syntax-property": "#83c092",
      "syntax-type": "#dbbc7f",
      "syntax-constant": "#e69875",
      "syntax-operator": "#83c092",
      "syntax-punctuation": "#d3c6aa",
      "syntax-object": "#e67e80",
      "markdown-heading": "#d699b6",
      "markdown-link": "#a7c080",
      "markdown-link-text": "#83c092",
      "markdown-code": "#a7c080",
      "markdown-block-quote": "#dbbc7f",
      "markdown-emph": "#dbbc7f",
      "markdown-strong": "#e69875",
      "markdown-horizontal-rule": "#7a8478",
      "markdown-list-item": "#a7c080",
      "markdown-list-enumeration": "#83c092",
      "markdown-image": "#a7c080",
      "markdown-image-text": "#83c092"
    }
  }
}
