{
  "$schema": "https://opencode.ai/desktop-theme.json",
  "name": "Catppuccin Macchiato",
  "id": "catppuccin-macchiato",
  "light": {
    "palette": {
      "neutral": "#eff1f5",
      "ink": "#4c4f69",
      "primary": "#1e66f5",
      "accent": "#8839ef",
      "success": "#40a02b",
      "warning": "#df8e1d",
      "error": "#d20f39",
      "info": "#179299",
      "interactive": "#1e66f5",
      "diffAdd": "#40a02b",
      "diffDelete": "#d20f39"
    },
    "surfaces": {
      "shell": "#e6e9ef",
      "canvas": "#eff1f5",
      "raised": "#ffffff",
      "inset": "#dce0e8"
    },
    "overrides": {
      "syntax-comment": "#8c8fa1",
      "syntax-keyword": "#7f57c8",
      "syntax-string": "#449f31",
      "syntax-primitive": "#396ed6",
      "syntax-variable": "#4c4f69",
      "syntax-property": "#396ed6",
      "syntax-type": "#df8e1d",
      "syntax-constant": "#f0723b",
      "syntax-operator": "#04a5e5",
      "syntax-punctuation": "#7c7f93",
      "syntax-object": "#4c4f69",
      "markdown-heading": "#7f57c8",
      "markdown-text": "#4c4f69",
      "markdown-link": "#396ed6",
      "markdown-link-text": "#179299",
      "markdown-code": "#449f31",
      "markdown-strong": "#4c4f69",
      "markdown-emph": "#f0723b",
      "markdown-block-quote": "#5c5f77",
      "markdown-code-block": "#4c4f69"
    }
  },
  "dark": {
    "palette": {
      "neutral": "#24273a",
      "ink": "#cad3f5",
      "primary": "#8aadf4",
      "accent": "#c6a0f6",
      "success": "#a6da95",
      "warning": "#eed49f",
      "error": "#ed8796",
      "info": "#8bd5ca",
      "interactive": "#8aadf4",
      "diffAdd": "#a6da95",
      "diffDelete": "#ed8796"
    },
    "surfaces": {
      "shell": "#1e2030",
      "canvas": "#24273a",
      "raised": "#363a4f",
      "inset": "#181926"
    },
    "overrides": {
      "syntax-comment": "#8087a2",
      "syntax-keyword": "#c6a0f6",
      "syntax-string": "#a6da95",
      "syntax-primitive": "#8aadf4",
      "syntax-variable": "#cad3f5",
      "syntax-property": "#8aadf4",
      "syntax-type": "#eed49f",
      "syntax-constant": "#f5a97f",
      "syntax-operator": "#91d7e3",
      "syntax-punctuation": "#939ab7",
      "syntax-object": "#cad3f5",
      "markdown-heading": "#c6a0f6",
      "markdown-text": "#cad3f5",
      "markdown-link": "#8aadf4",
      "markdown-link-text": "#8bd5ca",
      "markdown-code": "#a6da95",
      "markdown-strong": "#cad3f5",
      "markdown-emph": "#f5a97f",
      "markdown-block-quote": "#b8c0e0",
      "markdown-code-block": "#cad3f5"
    }
  }
}
