{
  "$schema": "https://opencode.ai/desktop-theme.json",
  "name": "Solarized",
  "id": "solarized",
  "light": {
    "palette": {
      "neutral": "#fdf6e3",
      "ink": "#586e75",
      "primary": "#268bd2",
      "accent": "#bc5681",
      "success": "#859820",
      "warning": "#b58900",
      "error": "#c1564d",
      "info": "#2aa198",
      "diffAdd": "#c6dc7a",
      "diffDelete": "#f2a1a1"
    },
    "surfaces": {
      "shell": "#eae4d2",
      "canvas": "#f9f4e4",
      "raised": "#fffaec",
      "inset": "#ddd5bf"
    },
    "overrides": {
      "syntax-comment": "#5e747c",
      "syntax-keyword": "#66780a",
      "syntax-string": "#1b7d76",
      "syntax-primitive": "#1b75b3",
      "syntax-property": "#1b75b3",
      "syntax-constant": "#b6507b",
      "text-interactive-base": "#1775b5"
    }
  },
  "dark": {
    "palette": {
      "neutral": "#002b36",
      "ink": "#93a1a1",
      "primary": "#6d72c1",
      "accent": "#b55d80",
      "success": "#86973a",
      "warning": "#b18a28",
      "error": "#b95d54",
      "info": "#2aa198",
      "diffAdd": "#4c7654",
      "diffDelete": "#b55956"
    },
    "surfaces": {
      "shell": "#0a2830",
      "canvas": "#173840",
      "raised": "#284b51",
      "inset": "#032029"
    },
    "overrides": {
      "syntax-comment": "#586e75",
      "syntax-keyword": "#86973a",
      "syntax-string": "#2aa198",
      "syntax-primitive": "#3c8bc8",
      "syntax-property": "#3c8bc8",
      "syntax-constant": "#b55d80"
    }
  }
}
