{
  "$schema": "https://opencode.ai/desktop-theme.json",
  "name": "Carbonfox",
  "id": "carbonfox",
  "light": {
    "palette": {
      "neutral": "#8e8e8e",
      "ink": "#161616",
      "primary": "#0072c3",
      "accent": "#da1e28",
      "success": "#198038",
      "warning": "#f1c21b",
      "error": "#da1e28",
      "info": "#0043ce",
      "interactive": "#0f62fe",
      "diffAdd": "#198038",
      "diffDelete": "#da1e28"
    },
    "surfaces": {
      "shell": "#e4e4e4",
      "canvas": "#f0f0f0",
      "raised": "#f9f9f9",
      "inset": "#dbdbdb"
    },
    "overrides": {
      "syntax-comment": "#696969",
      "syntax-keyword": "#7b56c8",
      "syntax-string": "#0a7931",
      "syntax-primitive": "#3166cd",
      "syntax-property": "#1d4db3",
      "syntax-type": "#8a5f00",
      "syntax-constant": "#bf3a37"
    }
  },
  "dark": {
    "palette": {
      "neutral": "#393939",
      "ink": "#f2f4f8",
      "primary": "#33b1ff",
      "accent": "#ff8389",
      "success": "#42be65",
      "warning": "#f1c21b",
      "error": "#ff8389",
      "info": "#78a9ff",
      "interactive": "#4589ff",
      "diffAdd": "#42be65",
      "diffDelete": "#ff8389"
    },
    "surfaces": {
      "shell": "#323232",
      "canvas": "#393939",
      "raised": "#474747",
      "inset": "#2b2b2b"
    },
    "overrides": {
      "syntax-comment": "#6f6f6f",
      "syntax-keyword": "#bd97fb",
      "syntax-string": "#56bb6f",
      "syntax-primitive": "#41b1fa",
      "syntax-property": "#78a9ff",
      "syntax-type": "#ecc347",
      "syntax-constant": "#fc858a"
    }
  }
}
