{
  "$schema": "https://opencode.ai/desktop-theme.json",
  "name": "Synthwave '84",
  "id": "synthwave84",
  "light": {
    "palette": {
      "neutral": "#fafafa",
      "ink": "#262335",
      "primary": "#00bcd4",
      "accent": "#8b4898",
      "success": "#5aac5c",
      "warning": "#f29f49",
      "error": "#d4685a",
      "info": "#e07558"
    },
    "surfaces": {
      "shell": "#eee6ef",
      "canvas": "#fbf6fb",
      "raised": "#fffbff",
      "inset": "#e1d7e4"
    },
    "overrides": {
      "syntax-comment": "#5c5c8a",
      "syntax-keyword": "#ba4e65",
      "syntax-string": "#a0621b",
      "syntax-primitive": "#ba5336",
      "syntax-variable": "#262335",
      "syntax-property": "#8b4898",
      "syntax-type": "#057c8c",
      "syntax-constant": "#8b4898",
      "syntax-operator": "#ba4e65",
      "syntax-punctuation": "#262335",
      "syntax-object": "#262335",
      "markdown-heading": "#ba4e65",
      "markdown-link": "#057c8c",
      "markdown-link-text": "#8b4898",
      "markdown-code": "#2c7f31",
      "markdown-block-quote": "#5c5c8a",
      "markdown-emph": "#a0621b",
      "markdown-strong": "#ba5336",
      "markdown-horizontal-rule": "#e0e0e0",
      "markdown-list-item": "#00bcd4",
      "markdown-list-enumeration": "#8b4898",
      "markdown-image": "#00bcd4",
      "markdown-image-text": "#8b4898",
      "text-interactive-base": "#1e7b8a"
    }
  },
  "dark": {
    "palette": {
      "neutral": "#262335",
      "ink": "#ffffff",
      "primary": "#6af5f2",
      "accent": "#ac8bdb",
      "success": "#86edbc",
      "warning": "#f8df7e",
      "error": "#d37471",
      "info": "#ea9864",
      "diffAdd": "#97f1d8",
      "diffDelete": "#dd7d76"
    },
    "surfaces": {
      "shell": "#241f31",
      "canvas": "#322a42",
      "raised": "#433754",
      "inset": "#1a1625"
    },
    "overrides": {
      "syntax-comment": "#848bbd",
      "syntax-keyword": "#e695cd",
      "syntax-string": "#f8df7e",
      "syntax-primitive": "#ea9864",
      "syntax-variable": "#ffffff",
      "syntax-property": "#ac8bdb",
      "syntax-type": "#6af5f2",
      "syntax-constant": "#ac8bdb",
      "syntax-operator": "#e695cd",
      "syntax-punctuation": "#ffffff",
      "syntax-object": "#ffffff",
      "markdown-heading": "#e695cd",
      "markdown-link": "#6af5f2",
      "markdown-link-text": "#ac8bdb",
      "markdown-code": "#86edbc",
      "markdown-block-quote": "#848bbd",
      "markdown-emph": "#f8df7e",
      "markdown-strong": "#ea9864",
      "markdown-horizontal-rule": "#495495",
      "markdown-list-item": "#6af5f2",
      "markdown-list-enumeration": "#ac8bdb",
      "markdown-image": "#6af5f2",
      "markdown-image-text": "#ac8bdb"
    }
  }
}
