{
  "$schema": "https://opencode.ai/desktop-theme.json",
  "name": "Arc",
  "id": "arc",
  "light": {
    "palette": {
      "neutral": "#F8F5FB",
      "ink": "#1A1625",
      "primary": "#685cb8",
      "accent": "#bc75c7",
      "interactive": "#553c95",
      "success": "#3e9f57",
      "warning": "#d27b2c",
      "error": "#be534a",
      "info": "#0891B2",
      "diffAdd": "#3e9f57",
      "diffDelete": "#be534a"
    },
    "surfaces": {
      "shell": "#eee9f3",
      "canvas": "#faf8fd",
      "raised": "#ffffff",
      "inset": "#e4deec"
    },
    "overrides": {
      "surface-float-base": "#1A1625",
      "surface-float-base-hover": "#221E2D",
      "button-primary-base": "#6C5D79",
      "icon-base": "#847CA0",
      "icon-hover": "#5C5670",
      "icon-active": "#1A1625",
      "icon-strong-base": "#1A1625",
      "syntax-comment": "#716d7c",
      "syntax-keyword": "#685cb8",
      "syntax-string": "#15803D",
      "syntax-primitive": "#bb5147",
      "syntax-variable": "#1A1625",
      "syntax-property": "#a94061",
      "syntax-type": "#b25514",
      "syntax-constant": "#0E7490",
      "syntax-operator": "#4A4458",
      "syntax-punctuation": "#4A4458",
      "syntax-object": "#1A1625",
      "markdown-heading": "#685cb8",
      "markdown-link": "#553c95",
      "markdown-link-text": "#1e7993",
      "markdown-code": "#915f81",
      "markdown-block-quote": "#6B667A",
      "markdown-emph": "#a85c0d",
      "markdown-strong": "#685cb8",
      "markdown-horizontal-rule": "#DDD5E8",
      "markdown-list-item": "#553c95",
      "markdown-list-enumeration": "#0891B2",
      "markdown-image": "#bc75c7",
      "markdown-image-text": "#0891B2"
    }
  },
  "dark": {
    "palette": {
      "neutral": "#30262d",
      "ink": "#E8E0F0",
      "primary": "#9882d3",
      "accent": "#ce84c0",
      "interactive": "#7664b3",
      "success": "#8ce1a3",
      "warning": "#f3ca6e",
      "error": "#ea8891",
      "info": "#5ee7f9",
      "diffAdd": "#8ce1a3",
      "diffDelete": "#ea8891"
    },
    "surfaces": {
      "shell": "#29232e",
      "canvas": "#352d3c",
      "raised": "#43394c",
      "inset": "#201a24"
    },
    "overrides": {
      "surface-interactive-weak-hover": "#675a6e",
      "surface-float-base": "#443a48",
      "surface-float-base-hover": "#544a5b",
      "button-primary-base": "#E8E0F0",
      "icon-base": "#9C8FA8",
      "icon-hover": "#C8BED4",
      "icon-active": "#E8E0F0",
      "icon-strong-base": "#E8E0F0",
      "syntax-comment": "#70637C",
      "syntax-keyword": "#9882d3",
      "syntax-string": "#8ce1a3",
      "syntax-primitive": "#ea8891",
      "syntax-variable": "#E8E0F0",
      "syntax-property": "#ce84c0",
      "syntax-type": "#f3ca6e",
      "syntax-constant": "#5ee7f9",
      "syntax-operator": "#C8BED4",
      "syntax-punctuation": "#C8BED4",
      "syntax-object": "#E8E0F0",
      "markdown-heading": "#9882d3",
      "markdown-link": "#7664b3",
      "markdown-link-text": "#5ee7f9",
      "markdown-code": "#c28db1",
      "markdown-block-quote": "#9C8FA8",
      "markdown-emph": "#f3ca6e",
      "markdown-strong": "#ce84c0",
      "markdown-horizontal-rule": "#584e62",
      "markdown-list-item": "#9882d3",
      "markdown-list-enumeration": "#5ee7f9",
      "markdown-image": "#ce84c0",
      "markdown-image-text": "#5ee7f9"
    }
  }
}
