{
  "$schema": "https://opencode.ai/desktop-theme.json",
  "name": "Palenight",
  "id": "palenight",
  "light": {
    "palette": {
      "neutral": "#fafafa",
      "ink": "#292d3e",
      "primary": "#4976eb",
      "accent": "#00acc1",
      "success": "#91b859",
      "warning": "#ffb300",
      "error": "#e53935",
      "info": "#f4511e"
    },
    "surfaces": {
      "shell": "#eeeeee",
      "canvas": "#fafafa",
      "raised": "#f5f5f5",
      "inset": "#e4e4e4"
    },
    "overrides": {
      "syntax-comment": "#63718a",
      "syntax-keyword": "#9058c7",
      "syntax-string": "#587b15",
      "syntax-primitive": "#426bd5",
      "syntax-variable": "#292d3e",
      "syntax-property": "#1b7b8a",
      "syntax-type": "#956809",
      "syntax-constant": "#c54621",
      "syntax-operator": "#1b7b8a",
      "syntax-punctuation": "#292d3e",
      "syntax-object": "#292d3e",
      "markdown-heading": "#9058c7",
      "markdown-link": "#426bd5",
      "markdown-link-text": "#1b7b8a",
      "markdown-code": "#587b15",
      "markdown-block-quote": "#63718a",
      "markdown-emph": "#956809",
      "markdown-strong": "#c54621",
      "markdown-horizontal-rule": "#8796b0",
      "markdown-list-item": "#4d78e3",
      "markdown-list-enumeration": "#00acc1",
      "markdown-image": "#4d78e3",
      "markdown-image-text": "#00acc1"
    }
  },
  "dark": {
    "palette": {
      "neutral": "#292d3e",
      "ink": "#a6accd",
      "primary": "#82aaff",
      "accent": "#89ddff",
      "success": "#c3e88d",
      "warning": "#ffcb6b",
      "error": "#f07178",
      "info": "#f78c6c"
    },
    "surfaces": {
      "shell": "#222637",
      "canvas": "#292d3e",
      "raised": "#373b4d",
      "inset": "#1c2030"
    },
    "overrides": {
      "syntax-comment": "#676e95",
      "syntax-keyword": "#c792ea",
      "syntax-string": "#c3e88d",
      "syntax-primitive": "#82aaff",
      "syntax-variable": "#a6accd",
      "syntax-property": "#89ddff",
      "syntax-type": "#ffcb6b",
      "syntax-constant": "#f78c6c",
      "syntax-operator": "#89ddff",
      "syntax-punctuation": "#a6accd",
      "syntax-object": "#a6accd",
      "markdown-heading": "#c792ea",
      "markdown-link": "#82aaff",
      "markdown-link-text": "#89ddff",
      "markdown-code": "#c3e88d",
      "markdown-block-quote": "#676e95",
      "markdown-emph": "#ffcb6b",
      "markdown-strong": "#f78c6c",
      "markdown-horizontal-rule": "#676e95",
      "markdown-list-item": "#82aaff",
      "markdown-list-enumeration": "#89ddff",
      "markdown-image": "#82aaff",
      "markdown-image-text": "#89ddff"
    }
  }
}
