{
  "$schema": "https://opencode.ai/desktop-theme.json",
  "name": "Rose Pine",
  "id": "rosepine",
  "light": {
    "palette": {
      "neutral": "#faf4ed",
      "ink": "#575279",
      "primary": "#31748f",
      "accent": "#d7827e",
      "success": "#286983",
      "warning": "#e89e3d",
      "error": "#b4637a",
      "info": "#56949f"
    },
    "surfaces": {
      "shell": "#eee5df",
      "canvas": "#fbf4ee",
      "raised": "#fffbf6",
      "inset": "#e2d6ce"
    },
    "overrides": {
      "syntax-comment": "#716c7d",
      "syntax-keyword": "#286983",
      "syntax-string": "#9c6202",
      "syntax-primitive": "#a75754",
      "syntax-variable": "#575279",
      "syntax-property": "#a75754",
      "syntax-type": "#397782",
      "syntax-constant": "#7b6593",
      "syntax-operator": "#6f6b88",
      "syntax-punctuation": "#6f6b88",
      "syntax-object": "#575279",
      "markdown-heading": "#7b6593",
      "markdown-link": "#31748f",
      "markdown-link-text": "#a75754",
      "markdown-code": "#286983",
      "markdown-block-quote": "#716c7d",
      "markdown-emph": "#9c6202",
      "markdown-strong": "#a4556c",
      "markdown-horizontal-rule": "#dfdad9",
      "markdown-list-item": "#31748f",
      "markdown-list-enumeration": "#d7827e",
      "markdown-image": "#31748f",
      "markdown-image-text": "#d7827e"
    }
  },
  "dark": {
    "palette": {
      "neutral": "#191724",
      "ink": "#e0def4",
      "primary": "#9ccfd8",
      "accent": "#ebbcba",
      "success": "#31748f",
      "warning": "#f6c177",
      "error": "#db7c95",
      "info": "#9ccfd8"
    },
    "surfaces": {
      "shell": "#191722",
      "canvas": "#272330",
      "raised": "#37303f",
      "inset": "#121019"
    },
    "overrides": {
      "syntax-comment": "#6e6a86",
      "syntax-keyword": "#31748f",
      "syntax-string": "#f6c177",
      "syntax-primitive": "#ebbcba",
      "syntax-variable": "#e0def4",
      "syntax-property": "#ebbcba",
      "syntax-type": "#9ccfd8",
      "syntax-constant": "#c4a7e7",
      "syntax-operator": "#908caa",
      "syntax-punctuation": "#908caa",
      "syntax-object": "#e0def4",
      "markdown-heading": "#c4a7e7",
      "markdown-link": "#9ccfd8",
      "markdown-link-text": "#ebbcba",
      "markdown-code": "#31748f",
      "markdown-block-quote": "#6e6a86",
      "markdown-emph": "#f6c177",
      "markdown-strong": "#db7c95",
      "markdown-horizontal-rule": "#403d52",
      "markdown-list-item": "#9ccfd8",
      "markdown-list-enumeration": "#ebbcba",
      "markdown-image": "#9ccfd8",
      "markdown-image-text": "#ebbcba"
    }
  }
}
