{
  "$schema": "https://opencode.ai/desktop-theme.json",
  "name": "Matrix",
  "id": "matrix",
  "light": {
    "palette": {
      "neutral": "#eef3ea",
      "ink": "#203022",
      "primary": "#60b96c",
      "accent": "#ba84df",
      "success": "#60b96c",
      "warning": "#e8fc8b",
      "error": "#de6f68",
      "info": "#45b3f7",
      "interactive": "#45b3f7",
      "diffAdd": "#5dac7e",
      "diffDelete": "#c0544e"
    },
    "surfaces": {
      "shell": "#e6ece4",
      "canvas": "#f6f9f3",
      "raised": "#fcfff9",
      "inset": "#d8e1d5"
    },
    "overrides": {
      "syntax-comment": "#607062",
      "syntax-keyword": "#8c59b0",
      "syntax-string": "#1c7c32",
      "syntax-primitive": "#1972a5",
      "syntax-variable": "#203022",
      "syntax-property": "#107a6b",
      "syntax-type": "#657218",
      "syntax-constant": "#985f10",
      "syntax-operator": "#107a6b",
      "syntax-punctuation": "#203022",
      "syntax-object": "#203022",
      "markdown-heading": "#107a6b",
      "markdown-link": "#1972a5",
      "markdown-link-text": "#107a6b",
      "markdown-code": "#1c7c32",
      "markdown-block-quote": "#607062",
      "markdown-emph": "#985f10",
      "markdown-strong": "#657218",
      "markdown-horizontal-rule": "#748476",
      "markdown-list-item": "#45b3f7",
      "markdown-list-enumeration": "#4df3d9",
      "markdown-image": "#45b3f7",
      "markdown-image-text": "#4df3d9",
      "text-interactive-base": "#1572a6"
    }
  },
  "dark": {
    "palette": {
      "neutral": "#0a0e0a",
      "ink": "#cbd8cc",
      "primary": "#9feca8",
      "accent": "#b689d6",
      "success": "#9ff2b2",
      "warning": "#e9fa9c",
      "error": "#d5766f",
      "info": "#5ab2ec",
      "interactive": "#5ab2ec",
      "diffAdd": "#9bf7bd",
      "diffDelete": "#e68582"
    },
    "surfaces": {
      "shell": "#101b15",
      "canvas": "#1a2820",
      "raised": "#293a2e",
      "inset": "#0a120e"
    },
    "overrides": {
      "syntax-comment": "#8ca391",
      "syntax-keyword": "#b689d6",
      "syntax-string": "#6cb675",
      "syntax-primitive": "#5ab2ec",
      "syntax-variable": "#9ff2b2",
      "syntax-property": "#6eefd8",
      "syntax-type": "#e9fa9c",
      "syntax-constant": "#f1ae65",
      "syntax-operator": "#6eefd8",
      "syntax-punctuation": "#9ff2b2",
      "syntax-object": "#9ff2b2",
      "markdown-heading": "#60eaf7",
      "markdown-link": "#5ab2ec",
      "markdown-link-text": "#6eefd8",
      "markdown-code": "#6cb675",
      "markdown-block-quote": "#8ca391",
      "markdown-emph": "#f1ae65",
      "markdown-strong": "#e9fa9c",
      "markdown-horizontal-rule": "#8ca391",
      "markdown-list-item": "#5ab2ec",
      "markdown-list-enumeration": "#6eefd8",
      "markdown-image": "#5ab2ec",
      "markdown-image-text": "#6eefd8"
    }
  }
}
