{
  "$schema": "https://opencode.ai/desktop-theme.json",
  "name": "Claude",
  "id": "claude",
  "light": {
    "palette": {
      "neutral": "#faf9f5",
      "ink": "#141413",
      "primary": "#d97757",
      "accent": "#c96442",
      "interactive": "#c96442",
      "success": "#2f7d4a",
      "warning": "#9b6a1d",
      "error": "#b53333",
      "info": "#5e5d59",
      "diffAdd": "#4f8f5b",
      "diffDelete": "#c96442"
    },
    "surfaces": {
      "shell": "#eeeae2",
      "canvas": "#faf9f5",
      "raised": "#ffffff",
      "inset": "#e3ded4"
    },
    "overrides": {
      "surface-float-base": "#ffffff",
      "surface-float-base-hover": "#faf9f5",
      "surface-brand-base": "#b2735f",
      "surface-brand-hover": "#a46752",
      "surface-interactive-base": "#93817a",
      "surface-interactive-hover": "#87746e",
      "surface-interactive-weak": "#edd9d1",
      "surface-interactive-weak-hover": "#dbc7c0",
      "surface-critical-base": "#f0dad7",
      "surface-warning-base": "#ebe3d1",
      "surface-success-base": "#dce9db",
      "input-active": "#f0eee6",
      "input-focus": "#f0eee6",
      "text-stronger": "#000000",
      "text-interactive-base": "#b55837",
      "text-on-brand-base": "#141413",
      "text-on-interactive-base": "#141413",
      "border-selected": "#c96442",
      "border-focus": "#c96442",
      "border-strong-hover": "#9c9a92",
      "border-interactive-base": "#c96442",
      "border-interactive-hover": "#b85a39",
      "button-primary-base": "#141413",
      "button-primary-text": "#faf9f5",
      "icon-base": "#73726c",
      "icon-hover": "#30302e",
      "icon-active": "#141413",
      "icon-weak-base": "#b0aea5",
      "icon-strong-base": "#141413",
      "icon-brand-base": "#c96442",
      "icon-interactive-base": "#c96442",
      "syntax-comment": "#74736c",
      "syntax-keyword": "#b55837",
      "syntax-info": "#5e5d59",
      "syntax-string": "#2f7d4a",
      "syntax-primitive": "#b95533",
      "syntax-variable": "#30302e",
      "syntax-property": "#8f5b3f",
      "syntax-type": "#7b642f",
      "syntax-constant": "#9a691b",
      "syntax-operator": "#5e5d59",
      "syntax-punctuation": "#73726c",
      "syntax-object": "#141413",
      "syntax-success": "#2f7d4a",
      "syntax-warning": "#9b6a1d",
      "syntax-critical": "#b53333",
      "syntax-diff-add": "#2f7d4a",
      "syntax-diff-delete": "#b53333",
      "markdown-heading": "#141413",
      "markdown-link": "#b55837",
      "markdown-link-text": "#b95533",
      "markdown-code": "#ad5d3d",
      "markdown-block-quote": "#73726c",
      "markdown-emph": "#9a691b",
      "markdown-strong": "#141413",
      "markdown-horizontal-rule": "#d1cfc5",
      "markdown-list-item": "#c96442",
      "markdown-list-enumeration": "#b85a39",
      "markdown-image": "#c96442",
      "markdown-image-text": "#b85a39"
    }
  },
  "dark": {
    "palette": {
      "neutral": "#141413",
      "ink": "#faf9f5",
      "primary": "#c46849",
      "accent": "#d97757",
      "interactive": "#d97757",
      "success": "#8fbf8f",
      "warning": "#d6b36a",
      "error": "#df6666",
      "info": "#c2c0b6",
      "diffAdd": "#8fbf8f",
      "diffDelete": "#df6666"
    },
    "surfaces": {
      "shell": "#191918",
      "canvas": "#262624",
      "raised": "#33332f",
      "inset": "#121211"
    },
    "overrides": {
      "surface-float-base": "#1f1e1d",
      "surface-float-base-hover": "#262624",
      "surface-brand-base": "#ad7664",
      "surface-brand-hover": "#bf8674",
      "surface-interactive-base": "#997f76",
      "surface-interactive-hover": "#aa8f86",
      "surface-interactive-weak": "#3e2822",
      "surface-interactive-weak-hover": "#4d362f",
      "surface-critical-base": "#382220",
      "surface-warning-base": "#3a2f1c",
      "surface-success-base": "#213426",
      "input-active": "#30302e",
      "input-focus": "#30302e",
      "text-stronger": "#ffffff",
      "text-interactive-base": "#df8a6d",
      "text-on-brand-base": "#141413",
      "text-on-interactive-base": "#141413",
      "border-selected": "#d47a5d",
      "border-focus": "#d47a5d",
      "border-strong-hover": "#73726c",
      "border-interactive-base": "#c26a4c",
      "border-interactive-hover": "#d47a5d",
      "button-primary-base": "#faf9f5",
      "button-primary-text": "#141413",
      "icon-base": "#b0aea5",
      "icon-hover": "#e8e6dc",
      "icon-active": "#faf9f5",
      "icon-weak-base": "#5e5d59",
      "icon-strong-base": "#faf9f5",
      "icon-brand-base": "#d47a5d",
      "icon-interactive-base": "#d47a5d",
      "syntax-comment": "#87867f",
      "syntax-keyword": "#df8a6d",
      "syntax-info": "#c2c0b6",
      "syntax-string": "#8fbf8f",
      "syntax-primitive": "#d97757",
      "syntax-variable": "#f0eee6",
      "syntax-property": "#d8a18d",
      "syntax-type": "#d6b36a",
      "syntax-constant": "#e0bd74",
      "syntax-operator": "#b0aea5",
      "syntax-punctuation": "#b0aea5",
      "syntax-object": "#faf9f5",
      "syntax-success": "#8fbf8f",
      "syntax-warning": "#d6b36a",
      "syntax-critical": "#dc6968",
      "syntax-diff-add": "#8fbf8f",
      "syntax-diff-delete": "#dc6968",
      "markdown-heading": "#faf9f5",
      "markdown-link": "#df8a6d",
      "markdown-link-text": "#d97757",
      "markdown-code": "#bc6a4a",
      "markdown-block-quote": "#b0aea5",
      "markdown-emph": "#d6b36a",
      "markdown-strong": "#faf9f5",
      "markdown-horizontal-rule": "#4d4c48",
      "markdown-list-item": "#d97757",
      "markdown-list-enumeration": "#df8a6d",
      "markdown-image": "#d97757",
      "markdown-image-text": "#df8a6d"
    }
  }
}
