{
  "$schema": "https://opencode.ai/desktop-theme.json",
  "name": "Aether",
  "id": "aether",
  "light": {
    "palette": {
      "neutral": "#FAF9F5",
      "ink": "#1A1612",
      "primary": "#C15F3C",
      "accent": "#A97E50",
      "interactive": "#B55837",
      "success": "#66800B",
      "warning": "#AD8301",
      "error": "#AF3029",
      "info": "#9A7B4F",
      "diffAdd": "#66800B",
      "diffDelete": "#AF3029"
    },
    "surfaces": {
      "shell": "#eee8de",
      "canvas": "#faf7f1",
      "raised": "#fffcf8",
      "inset": "#e5ddd0"
    },
    "overrides": {
      "surface-float-base": "#FFFFFF",
      "surface-float-base-hover": "#F5F0E8",
      "button-primary-base": "#b95533",
      "icon-base": "#8A7D6C",
      "icon-hover": "#5C5245",
      "icon-active": "#2A2520",
      "icon-strong-base": "#2A2520",
      "syntax-comment": "#776a5f",
      "syntax-keyword": "#776a5f",
      "syntax-info": "#427B58",
      "syntax-string": "#767006",
      "syntax-primitive": "#9a0f0f",
      "syntax-variable": "#282828",
      "syntax-property": "#8F5B3F",
      "syntax-type": "#986206",
      "syntax-constant": "#9A691B",
      "syntax-operator": "#3C3836",
      "syntax-punctuation": "#3C3836",
      "syntax-object": "#282828",
      "markdown-heading": "#b1502d",
      "markdown-link": "#B55837",
      "markdown-link-text": "#9C7A3C",
      "markdown-code": "#A9653E",
      "markdown-block-quote": "#6B5F4E",
      "markdown-emph": "#896810",
      "markdown-strong": "#b1502d",
      "markdown-horizontal-rule": "#DDD6C8",
      "markdown-list-item": "#BC5215",
      "markdown-list-enumeration": "#B0793C",
      "markdown-image": "#A97E50",
      "markdown-image-text": "#B0793C"
    }
  },
  "dark": {
    "palette": {
      "neutral": "#171411",
      "ink": "#E8E0D2",
      "primary": "#D97757",
      "accent": "#B58B61",
      "interactive": "#B86F52",
      "success": "#879A39",
      "warning": "#D0A215",
      "error": "#D14D41",
      "info": "#B08B65",
      "diffAdd": "#879A39",
      "diffDelete": "#D14D41"
    },
    "surfaces": {
      "shell": "#1a1714",
      "canvas": "#24201b",
      "raised": "#302a23",
      "inset": "#12100e"
    },
    "overrides": {
      "surface-float-base": "#2A2722",
      "surface-float-base-hover": "#302D28",
      "button-primary-base": "#F0EBE2",
      "syntax-comment": "#A89984",
      "syntax-info": "#8EC07C",
      "syntax-keyword": "#A89984",
      "syntax-string": "#b7bb3d",
      "syntax-primitive": "#dc6b5a",
      "syntax-variable": "#FBF1C7",
      "syntax-property": "#C79B87",
      "syntax-type": "#f6bf48",
      "syntax-constant": "#D3869B",
      "syntax-operator": "#EBDBB2",
      "syntax-punctuation": "#EBDBB2",
      "syntax-object": "#FBF1C7",
      "markdown-heading": "#D97757",
      "markdown-link": "#D09276",
      "markdown-link-text": "#C9A36B",
      "markdown-code": "#fccc54",
      "markdown-block-quote": "#9C8E7A",
      "markdown-emph": "#d0a219",
      "markdown-strong": "#D97757",
      "markdown-horizontal-rule": "#3A3630",
      "markdown-list-item": "#d67336",
      "markdown-list-enumeration": "#C9A36B",
      "markdown-image": "#B58B61",
      "markdown-image-text": "#C9A36B"
    }
  }
}
