{
  "$schema": "https://opencode.ai/desktop-theme.json",
  "name": "Orng",
  "id": "orng",
  "light": {
    "palette": {
      "neutral": "#ffffff",
      "ink": "#1a1a1a",
      "primary": "#d76e4e",
      "accent": "#be5838",
      "success": "#2e67b7",
      "warning": "#d76e4e",
      "error": "#bd514f",
      "info": "#318795",
      "diffDelete": "#d06274"
    },
    "surfaces": {
      "shell": "#eee8e3",
      "canvas": "#faf7f3",
      "raised": "#fffdfa",
      "inset": "#e2d9d1"
    },
    "overrides": {
      "syntax-comment": "#727272",
      "syntax-keyword": "#bc5536",
      "syntax-string": "#2e67b7",
      "syntax-primitive": "#bb5535",
      "syntax-variable": "#bd514f",
      "syntax-property": "#257d8b",
      "syntax-type": "#926d0f",
      "syntax-constant": "#bc5536",
      "syntax-operator": "#257d8b",
      "syntax-punctuation": "#1a1a1a",
      "syntax-object": "#bd514f",
      "markdown-heading": "#bc5536",
      "markdown-link": "#bc5536",
      "markdown-link-text": "#257d8b",
      "markdown-code": "#2e67b7",
      "markdown-block-quote": "#926d0f",
      "markdown-emph": "#926d0f",
      "markdown-strong": "#bc5536",
      "markdown-horizontal-rule": "#8a8a8a",
      "markdown-list-item": "#d76e4e",
      "markdown-list-enumeration": "#318795",
      "markdown-image": "#d76e4e",
      "markdown-image-text": "#318795",
      "text-interactive-base": "#ba5435"
    }
  },
  "dark": {
    "palette": {
      "neutral": "#0a0a0a",
      "ink": "#eeeeee",
      "primary": "#ce7459",
      "accent": "#FFF7F1",
      "success": "#6ba1e6",
      "warning": "#ce7459",
      "error": "#d5757b",
      "info": "#56b6c2",
      "diffDelete": "#d5757c"
    },
    "surfaces": {
      "shell": "#1c1713",
      "canvas": "#29221c",
      "raised": "#382e25",
      "inset": "#130f0c"
    },
    "overrides": {
      "syntax-comment": "#808080",
      "syntax-keyword": "#ce7459",
      "syntax-string": "#6ba1e6",
      "syntax-primitive": "#dd8561",
      "syntax-variable": "#d5757b",
      "syntax-property": "#56b6c2",
      "syntax-type": "#e5c07b",
      "syntax-constant": "#FFF7F1",
      "syntax-operator": "#56b6c2",
      "syntax-punctuation": "#eeeeee",
      "syntax-object": "#d5757b",
      "markdown-heading": "#ce7459",
      "markdown-link": "#ce7459",
      "markdown-link-text": "#56b6c2",
      "markdown-code": "#6ba1e6",
      "markdown-block-quote": "#FFF7F1",
      "markdown-emph": "#e5c07b",
      "markdown-strong": "#dd8561",
      "markdown-horizontal-rule": "#808080",
      "markdown-list-item": "#ce7459",
      "markdown-list-enumeration": "#56b6c2",
      "markdown-image": "#ce7459",
      "markdown-image-text": "#56b6c2"
    }
  }
}
