{
  "$schema": "https://opencode.ai/desktop-theme.json",
  "name": "Osaka Jade",
  "id": "osaka-jade",
  "light": {
    "palette": {
      "neutral": "#F6F5DD",
      "ink": "#111c18",
      "primary": "#1faa90",
      "accent": "#3d7a52",
      "success": "#3d7a52",
      "warning": "#b5a020",
      "error": "#c7392d",
      "info": "#1faa90"
    },
    "surfaces": {
      "shell": "#eae9d2",
      "canvas": "#F6F5DD",
      "raised": "#fffee8",
      "inset": "#e0dfc8"
    },
    "overrides": {
      "syntax-comment": "#53685B",
      "syntax-keyword": "#0e7c69",
      "syntax-string": "#3d7a52",
      "syntax-primitive": "#3d7560",
      "syntax-variable": "#111c18",
      "syntax-property": "#3d7a52",
      "syntax-type": "#3d7a52",
      "syntax-constant": "#a75179",
      "syntax-operator": "#7c6e1b",
      "syntax-punctuation": "#111c18",
      "syntax-object": "#111c18",
      "markdown-heading": "#0e7c69",
      "markdown-link": "#0e7c69",
      "markdown-link-text": "#3d7a52",
      "markdown-code": "#3d7a52",
      "markdown-block-quote": "#53685B",
      "markdown-emph": "#a75179",
      "markdown-strong": "#111c18",
      "markdown-horizontal-rule": "#53685B",
      "markdown-list-item": "#1faa90",
      "markdown-list-enumeration": "#1faa90",
      "markdown-image": "#1faa90",
      "markdown-image-text": "#3d7a52",
      "text-interactive-base": "#017b67"
    }
  },
  "dark": {
    "palette": {
      "neutral": "#111c18",
      "ink": "#C1C497",
      "primary": "#2DD5B7",
      "accent": "#549e6a",
      "success": "#549e6a",
      "warning": "#E5C736",
      "error": "#FF5345",
      "info": "#2DD5B7",
      "interactive": "#8CD3CB",
      "diffAdd": "#63b07a",
      "diffDelete": "#db9f9c"
    },
    "surfaces": {
      "shell": "#0b1612",
      "canvas": "#111c18",
      "raised": "#1e2925",
      "inset": "#06100c"
    },
    "overrides": {
      "syntax-comment": "#53685B",
      "syntax-keyword": "#2DD5B7",
      "syntax-string": "#63b07a",
      "syntax-primitive": "#509475",
      "syntax-variable": "#C1C497",
      "syntax-property": "#549e6a",
      "syntax-type": "#549e6a",
      "syntax-constant": "#d2689c",
      "syntax-operator": "#459451",
      "syntax-punctuation": "#C1C497",
      "syntax-object": "#C1C497",
      "markdown-heading": "#2DD5B7",
      "markdown-link": "#8CD3CB",
      "markdown-link-text": "#549e6a",
      "markdown-code": "#63b07a",
      "markdown-block-quote": "#53685B",
      "markdown-emph": "#d2689c",
      "markdown-strong": "#C1C497",
      "markdown-horizontal-rule": "#53685B",
      "markdown-list-item": "#2DD5B7",
      "markdown-list-enumeration": "#8CD3CB",
      "markdown-image": "#8CD3CB",
      "markdown-image-text": "#549e6a"
    }
  }
}
