{
  "$schema": "https://opencode.ai/desktop-theme.json",
  "name": "Zenburn",
  "id": "zenburn",
  "light": {
    "palette": {
      "neutral": "#ffffef",
      "ink": "#3f3f3f",
      "primary": "#5f7f8f",
      "accent": "#5f8f8f",
      "success": "#5f8f5f",
      "warning": "#8f8f5f",
      "error": "#8f5f5f",
      "info": "#8f7f5f"
    },
    "surfaces": {
      "shell": "#f3f3e3",
      "canvas": "#ffffef",
      "raised": "#fafaea",
      "inset": "#e9e9da"
    },
    "overrides": {
      "syntax-comment": "#5a7a5a",
      "syntax-keyword": "#757546",
      "syntax-string": "#8f5f5f",
      "syntax-primitive": "#577787",
      "syntax-variable": "#3f3f3f",
      "syntax-property": "#4b7b7b",
      "syntax-type": "#4b7b7b",
      "syntax-constant": "#4f7e4f",
      "syntax-operator": "#757546",
      "syntax-punctuation": "#3f3f3f",
      "syntax-object": "#3f3f3f",
      "markdown-heading": "#757546",
      "markdown-link": "#577787",
      "markdown-link-text": "#4b7b7b",
      "markdown-code": "#4f7e4f",
      "markdown-block-quote": "#6f6f6f",
      "markdown-emph": "#757546",
      "markdown-strong": "#817151",
      "markdown-horizontal-rule": "#6f6f6f",
      "markdown-list-item": "#5f7f8f",
      "markdown-list-enumeration": "#5f8f8f",
      "markdown-image": "#5f7f8f",
      "markdown-image-text": "#5f8f8f"
    }
  },
  "dark": {
    "palette": {
      "neutral": "#3f3f3f",
      "ink": "#dcdccc",
      "primary": "#8cd0d3",
      "accent": "#93e0e3",
      "success": "#7f9f7f",
      "warning": "#f0dfaf",
      "error": "#cc9393",
      "info": "#dfaf8f",
      "diffAdd": "#8fb28f",
      "diffDelete": "#dca3a3"
    },
    "surfaces": {
      "shell": "#383838",
      "canvas": "#3f3f3f",
      "raised": "#4e4e4e",
      "inset": "#313131"
    },
    "overrides": {
      "syntax-comment": "#7f9f7f",
      "syntax-keyword": "#f0dfaf",
      "syntax-string": "#cc9393",
      "syntax-primitive": "#8cd0d3",
      "syntax-variable": "#dcdccc",
      "syntax-property": "#93e0e3",
      "syntax-type": "#93e0e3",
      "syntax-constant": "#8fb28f",
      "syntax-operator": "#f0dfaf",
      "syntax-punctuation": "#dcdccc",
      "syntax-object": "#dcdccc",
      "markdown-heading": "#f0dfaf",
      "markdown-link": "#8cd0d3",
      "markdown-link-text": "#93e0e3",
      "markdown-code": "#7f9f7f",
      "markdown-block-quote": "#9f9f9f",
      "markdown-emph": "#e0cf9f",
      "markdown-strong": "#dfaf8f",
      "markdown-horizontal-rule": "#9f9f9f",
      "markdown-list-item": "#8cd0d3",
      "markdown-list-enumeration": "#93e0e3",
      "markdown-image": "#8cd0d3",
      "markdown-image-text": "#93e0e3"
    }
  }
}
