{
  "$schema": "https://opencode.ai/desktop-theme.json",
  "name": "Nord",
  "id": "nord",
  "light": {
    "palette": {
      "neutral": "#eceff4",
      "ink": "#2e3440",
      "primary": "#5e81ac",
      "accent": "#bf616a",
      "success": "#8fbcbb",
      "warning": "#d08770",
      "error": "#bf616a",
      "info": "#81a1c1",
      "diffAdd": "#a3be8c",
      "diffDelete": "#bf616a"
    },
    "surfaces": {
      "shell": "#e0e3e8",
      "canvas": "#eceff4",
      "raised": "#f5f8fd",
      "inset": "#d7dadf"
    },
    "overrides": {
      "syntax-comment": "#646b7b",
      "syntax-keyword": "#4b6d97",
      "syntax-string": "#5a7244",
      "syntax-primitive": "#4b6d97",
      "syntax-constant": "#835f7c",
      "text-interactive-base": "#416da2"
    }
  },
  "dark": {
    "palette": {
      "neutral": "#2e3440",
      "ink": "#e5e9f0",
      "primary": "#88c0d0",
      "accent": "#d57780",
      "success": "#a3be8c",
      "warning": "#d08770",
      "error": "#bf616a",
      "info": "#81a1c1",
      "diffAdd": "#81a1c1",
      "diffDelete": "#bf616a"
    },
    "surfaces": {
      "shell": "#272d39",
      "canvas": "#2e3440",
      "raised": "#3c424f",
      "inset": "#212632"
    },
    "overrides": {
      "syntax-comment": "#616e88",
      "syntax-keyword": "#81a1c1",
      "syntax-primitive": "#88c0d0",
      "syntax-constant": "#b48ead"
    }
  }
}
