{
  "$schema": "https://opencode.ai/desktop-theme.json",
  "name": "Aura",
  "id": "aura",
  "light": {
    "palette": {
      "neutral": "#f5f0ff",
      "ink": "#2d2640",
      "primary": "#a277ff",
      "accent": "#d94f4f",
      "success": "#40bf7a",
      "warning": "#d9a24a",
      "error": "#d94f4f",
      "info": "#5bb8d9",
      "diffAdd": "#b3e6cc",
      "diffDelete": "#f5b3b3"
    },
    "surfaces": {
      "shell": "#e9e4f3",
      "canvas": "#f5f0ff",
      "raised": "#fcfbff",
      "inset": "#dfdbe9"
    },
    "overrides": {
      "syntax-comment": "#6e6983",
      "syntax-keyword": "#745acd",
      "syntax-string": "#187d4b",
      "syntax-primitive": "#2570af",
      "syntax-property": "#9c5e10",
      "syntax-type": "#187d4b",
      "syntax-constant": "#c33d3f",
      "text-interactive-base": "#7c5fbb"
    }
  },
  "dark": {
    "palette": {
      "neutral": "#15141b",
      "ink": "#edecee",
      "primary": "#a277ff",
      "accent": "#ff6767",
      "success": "#61ffca",
      "warning": "#ffca85",
      "error": "#ff6767",
      "info": "#82e2ff",
      "diffAdd": "#61ffca",
      "diffDelete": "#ff6767"
    },
    "surfaces": {
      "shell": "#0f0e15",
      "canvas": "#15141b",
      "raised": "#222128",
      "inset": "#09080f"
    },
    "overrides": {
      "syntax-comment": "#6d6a7e",
      "syntax-keyword": "#9e82e5",
      "syntax-string": "#6cfdcb",
      "syntax-primitive": "#82e2ff",
      "syntax-property": "#ffca85",
      "syntax-type": "#6cfdcb",
      "syntax-constant": "#ed7875"
    }
  }
}
