{
  "$schema": "https://opencode.ai/desktop-theme.json",
  "name": "Cobalt2",
  "id": "cobalt2",
  "light": {
    "palette": {
      "neutral": "#ffffff",
      "ink": "#193549",
      "primary": "#0066cc",
      "accent": "#00acc1",
      "success": "#4caf50",
      "warning": "#ff9800",
      "error": "#e91e63",
      "info": "#ff5722"
    },
    "surfaces": {
      "shell": "#f3f3f3",
      "canvas": "#ffffff",
      "raised": "#fafafa",
      "inset": "#e9e9e9"
    },
    "overrides": {
      "syntax-comment": "#5c6b7d",
      "syntax-keyword": "#ca4a25",
      "syntax-string": "#178424",
      "syntax-primitive": "#a76201",
      "syntax-variable": "#193549",
      "syntax-property": "#1f7e8c",
      "syntax-type": "#1f7e8c",
      "syntax-constant": "#cb4665",
      "syntax-operator": "#ca4a25",
      "syntax-punctuation": "#193549",
      "syntax-object": "#193549",
      "markdown-heading": "#a76201",
      "markdown-link": "#0d67c8",
      "markdown-link-text": "#1f7e8c",
      "markdown-code": "#178424",
      "markdown-block-quote": "#5c6b7d",
      "markdown-emph": "#ca4a25",
      "markdown-strong": "#cb4665",
      "markdown-horizontal-rule": "#d3dae3",
      "markdown-list-item": "#0d67c8",
      "markdown-list-enumeration": "#00acc1",
      "markdown-image": "#0d67c8",
      "markdown-image-text": "#00acc1"
    }
  },
  "dark": {
    "palette": {
      "neutral": "#193549",
      "ink": "#ffffff",
      "primary": "#0088ff",
      "accent": "#2affdf",
      "success": "#9eff80",
      "warning": "#ffc600",
      "error": "#ff0088",
      "info": "#ff9d00",
      "diffAdd": "#b9ff9f",
      "diffDelete": "#ff5fb3"
    },
    "surfaces": {
      "shell": "#122e42",
      "canvas": "#193549",
      "raised": "#274358",
      "inset": "#0a273a"
    },
    "overrides": {
      "syntax-comment": "#448bdf",
      "syntax-keyword": "#f4a343",
      "syntax-string": "#b0f99a",
      "syntax-primitive": "#f7c84f",
      "syntax-variable": "#ffffff",
      "syntax-property": "#50fcdf",
      "syntax-type": "#50fcdf",
      "syntax-constant": "#eb7791",
      "syntax-operator": "#f4a343",
      "syntax-punctuation": "#ffffff",
      "syntax-object": "#ffffff",
      "markdown-heading": "#f7c84f",
      "markdown-link": "#448bdf",
      "markdown-link-text": "#50fcdf",
      "markdown-code": "#b0f99a",
      "markdown-block-quote": "#adb7c9",
      "markdown-emph": "#f4a343",
      "markdown-strong": "#eb7791",
      "markdown-horizontal-rule": "#2d5a7b",
      "markdown-list-item": "#448bdf",
      "markdown-list-enumeration": "#50fcdf",
      "markdown-image": "#448bdf",
      "markdown-image-text": "#50fcdf"
    }
  }
}
