{
  "$schema": "https://opencode.ai/desktop-theme.json",
  "name": "Night Owl",
  "id": "nightowl",
  "light": {
    "palette": {
      "neutral": "#f0f0f0",
      "ink": "#403f53",
      "primary": "#4e77cd",
      "accent": "#963c78",
      "success": "#2aa298",
      "warning": "#c96765",
      "error": "#c65a53",
      "info": "#4e77cd",
      "diffAdd": "#2aa298",
      "diffDelete": "#c65a53"
    },
    "surfaces": {
      "shell": "#e6ecf0",
      "canvas": "#f6f9fb",
      "raised": "#fdfeff",
      "inset": "#d9e1e7"
    },
    "overrides": {
      "syntax-comment": "#666d6d",
      "syntax-keyword": "#8d56ad",
      "syntax-primitive": "#4169bd",
      "syntax-constant": "#ad4e4d",
      "text-interactive-base": "#416abe"
    }
  },
  "dark": {
    "palette": {
      "neutral": "#011627",
      "ink": "#d6deeb",
      "primary": "#86abf8",
      "accent": "#ee9176",
      "success": "#c7e287",
      "warning": "#ecc48d",
      "error": "#d0716a",
      "info": "#86abf8",
      "diffAdd": "#c7e287",
      "diffDelete": "#d0716a"
    },
    "surfaces": {
      "shell": "#0d202c",
      "canvas": "#19303e",
      "raised": "#294251",
      "inset": "#071720"
    },
    "overrides": {
      "syntax-comment": "#637777",
      "syntax-keyword": "#c495e3",
      "syntax-string": "#ecc48d",
      "syntax-primitive": "#86abf8",
      "syntax-constant": "#ee9176"
    }
  }
}
