{
  "$schema": "https://opencode.ai/desktop-theme.json",
  "name": "Lucent Orng",
  "id": "lucent-orng",
  "light": {
    "palette": {
      "neutral": "#fff5f0",
      "ink": "#1a1a1a",
      "primary": "#d76e4e",
      "accent": "#be5838",
      "success": "#2e67b7",
      "warning": "#d76e4e",
      "error": "#bd514f",
      "info": "#318795",
      "diffDelete": "#d06274"
    },
    "surfaces": {
      "shell": "#efe5dd",
      "canvas": "#fcf5ef",
      "raised": "#fffbf7",
      "inset": "#e3d7cc"
    },
    "overrides": {
      "syntax-comment": "#6e6e6e",
      "syntax-keyword": "#b75132",
      "syntax-string": "#2e67b7",
      "syntax-primitive": "#b65031",
      "syntax-variable": "#b94e4c",
      "syntax-property": "#1e7986",
      "syntax-type": "#8e6804",
      "syntax-constant": "#b75132",
      "syntax-operator": "#1e7986",
      "syntax-punctuation": "#1a1a1a",
      "syntax-object": "#b94e4c",
      "markdown-heading": "#b75132",
      "markdown-link": "#b75132",
      "markdown-link-text": "#1e7986",
      "markdown-code": "#2e67b7",
      "markdown-block-quote": "#8e6804",
      "markdown-emph": "#8e6804",
      "markdown-strong": "#b75132",
      "markdown-horizontal-rule": "#8a8a8a",
      "markdown-list-item": "#d76e4e",
      "markdown-list-enumeration": "#318795",
      "markdown-image": "#d76e4e",
      "markdown-image-text": "#318795",
      "text-interactive-base": "#b65131"
    }
  },
  "dark": {
    "palette": {
      "neutral": "#2a1a15",
      "ink": "#eeeeee",
      "primary": "#ce7459",
      "accent": "#FFF7F1",
      "success": "#6ba1e6",
      "warning": "#ce7459",
      "error": "#d5757b",
      "info": "#56b6c2",
      "diffDelete": "#d5757c"
    },
    "surfaces": {
      "shell": "#241914",
      "canvas": "#32231c",
      "raised": "#423026",
      "inset": "#1a110e"
    },
    "overrides": {
      "syntax-comment": "#808080",
      "syntax-keyword": "#ce7459",
      "syntax-string": "#6ba1e6",
      "syntax-primitive": "#dd8561",
      "syntax-variable": "#d5757b",
      "syntax-property": "#56b6c2",
      "syntax-type": "#e5c07b",
      "syntax-constant": "#FFF7F1",
      "syntax-operator": "#56b6c2",
      "syntax-punctuation": "#eeeeee",
      "syntax-object": "#d5757b",
      "markdown-heading": "#ce7459",
      "markdown-link": "#ce7459",
      "markdown-link-text": "#56b6c2",
      "markdown-code": "#6ba1e6",
      "markdown-block-quote": "#FFF7F1",
      "markdown-emph": "#e5c07b",
      "markdown-strong": "#dd8561",
      "markdown-horizontal-rule": "#808080",
      "markdown-list-item": "#ce7459",
      "markdown-list-enumeration": "#56b6c2",
      "markdown-image": "#ce7459",
      "markdown-image-text": "#56b6c2"
    }
  }
}
